{
  "id": "case_1",
  "specVersion": "0.1",
  "tenantId": "tenant_demo",
  "customerId": "cus_verified",
  "profile": "ecommerce",
  "channel": "email",
  "subject": "Refund request for order ord_small",
  "status": "open",
  "priority": "normal",
  "assigneeType": "agent",
  "tags": ["refund"],
  "evidenceIds": ["ev_1"],
  "createdAt": "2026-01-15T10:00:00Z",
  "updatedAt": "2026-01-15T10:00:00Z"
}
